{
  "from_version": "0.7.0",
  "to_version": "0.8.0",
  "note": "Annotation layers added (word gloss + transliteration on tokens; Lane's Lexicon on roots). No token or verse identifier changed, so no id is remapped and every prior id resolves to itself.",
  "default_resolution": "identity",
  "default_resolution_note": "Every v0.7.0 id is unchanged in v0.8.0 and resolves to itself. No ids changed form, so 'mappings' is empty. This makes the mapping total: every prior id resolves to exactly one successor (itself).",
  "mappings": []
}
