{
  "from_version": "0.3.0",
  "to_version": "0.4.0",
  "note": "Metadata-only release: output checksums were added to manifest.json. No identifier changed, so no id is remapped and every prior id resolves to itself.",
  "default_resolution": "identity",
  "default_resolution_note": "Every v0.3.0 id is unchanged in v0.4.0 and resolves to itself. No ids changed form, so 'mappings' is empty. This makes the mapping total: every prior id resolves to exactly one successor (itself).",
  "mappings": []
}
