{
  "from_version": "0.6.0",
  "to_version": "0.7.0",
  "note": "Translation edition added (Talal Itani, display-only): aligned to existing verse ids. No token or verse identifier changed, so no id is remapped and every prior id resolves to itself.",
  "default_resolution": "identity",
  "default_resolution_note": "Every v0.6.0 id is unchanged in v0.7.0 and resolves to itself. No ids changed form, so 'mappings' is empty. This makes the mapping total: every prior id resolves to exactly one successor (itself).",
  "mappings": []
}
